<?xml version="1.0"?>
<movies xmlns:xsi="http://www.w3.org/2001/XMLSchema-instance"
        xmlns="http://sample"
        xsi:schemaLocation="http://sample Movies.xsd">
    <movie>
        <Title>Spider-Man: Homecoming</Title>
        <Year>2017</Year>
        <Genre>Fantasy</Genre>
        <Actor>
            <Name>Tom Holland</Name>
            <DateOfBirth>1996-06-01</DateOfBirth>
        </Actor>
        <Actor>
            <Name>Zendaya</Name>
            <DateOfBirth>1996-09-01</DateOfBirth>
        </Actor>
    </movie>
    <movie>
        <Title>Logan</Title>
        <Year>2017</Year>
        <Genre>Drama</Genre>
        <Actor>
            <Name>Hugh Jackman</Name>
            <DateOfBirth>1968-10-12</DateOfBirth>
        </Actor>
        <Actor>
            <Name>Patrick Stewart</Name>
            <DateOfBirth>1940-07-13</DateOfBirth>
        </Actor>
    </movie>
    <movie>
        <Title>Harry Potter and the Deathly Hallows - Part 2</Title>
        <Year>2011</Year>
        <Genre>Fantasy</Genre>
        <Actor>
            <Name>Daniel Radcliff</Name>
            <DateOfBirth>1989-07-23</DateOfBirth>
        </Actor>
    </movie>
</movies>
